published_date,title,url,source_domain,feed_name_effective,feed_name
20/02/2026,THE COACH WHO TOOK AFGHANISTAN FROM RANKS TO RICHES! - YouTube,https://www.youtube.com/watch?v=iDYjPyP3DGM,youtube.com,,Researchers - Batch 02 (Tzarum→Zemel)
20/02/2026,Alexander Lingas Retires as Cappella Romana Music Director - The National Herald,https://www.thenationalherald.com/alexander-lingas-retires-as-cappella-romana-music-director/,thenationalherald.com,,Researchers - Batch 03 (Shifman Sagiv→Tsvelikhovsky)
20/02/2026,Names of Pakistan Hockey Team&#39;s New Proposed Squad Revealed - YouTube,https://www.youtube.com/watch?v=tuKnoejdfew,youtube.com,,Researchers - Batch 02 (Tzarum→Zemel)
20/02/2026,"Postscript: Bait Lady and Guerrilla Girl — Remembering Bonnie Van Allen, from Homosassa ...",https://www.chronicleonline.com/news/local/postscript-bait-lady-and-guerrilla-girl-remembering-bonnie-van-allen-from-homosassa-river-icon-to/article_846c2abf-7f64-5762-afbb-bb8acd870378.html,chronicleonline.com,,Researchers - Batch 03 (Shifman Sagiv→Tsvelikhovsky)
20/02/2026,FCT poll: Voters ready to back APC – Chairman - Peoples Daily Newspaper,https://peoplesdailyng.com/fct-poll-voters-ready-to-back-apc-chairman/,peoplesdailyng.com,,Companies - Batch 04 (Cytovia→Lyotropic Delivery Systems)
20/02/2026,Storm-Damaged Santa Monica Channel Loses Capacity as Concrete Peels Away (Video),https://palisadesnews.com/storm-damaged-santa-monica-channel-loses-capacity-as-concrete-peels-away-video/,palisadesnews.com,,Researchers - Batch 03 (Shifman Sagiv→Tsvelikhovsky)
20/02/2026,&#39;Laughing&#39; beautician caught with <b>hippy</b> crack in flash BMW after cops pulled her over for ... - The Sun,https://www.thesun.co.uk/news/38278621/beautician-hippy-crack-bmw-three-tyres/,thesun.co.uk,,Companies - Batch 04 (Cytovia→Lyotropic Delivery Systems)
20/02/2026,OptionMetrics Upgrades IvyDB Databases - LeapRate,https://www.leaprate.com/forex/institutional/optionmetrics-upgrades-ivydb-databases/,leaprate.com,,Researchers - Batch 03 (Shifman Sagiv→Tsvelikhovsky)
20/02/2026,"ESPN, MLB Take New Swing at Games They Hope Bring Die-Hard Fans to Streaming",https://m.imdb.com/news/ni65717149/?ref_=nwc_art_perm,m.imdb.com,,Researchers - Batch 03 (Shifman Sagiv→Tsvelikhovsky)
20/02/2026,MoFo&#39;s Markets &amp; Innovation | Morrison &amp; Foerster LLP - JDSupra,https://www.jdsupra.com/legalnews/mofo-s-markets-innovation-4192905/,jdsupra.com,,Researchers - Batch 03 (Shifman Sagiv→Tsvelikhovsky)
20/02/2026,Mandurah Race 1 Betting Odds,https://www.odds.com.au/greyhounds/mandurah-20260220/race-1/?date=2026-2-20,odds.com.au,,Companies - Batch 04 (Cytovia→Lyotropic Delivery Systems)
20/02/2026,Cloudy with a chance of missiles - JNS.org,https://www.jns.org/cloudy-with-a-chance-of-missiles/,jns.org,,Researchers - Batch 02 (Tzarum→Zemel)
20/02/2026,Take Me to Church–reborn as Sam Smith and Hozier create magic in San Francisco,https://t2online.in/music/western/take-me-to-church-reborn-as-sam-smith-and-hozier-create-magic-in-san-francisco/2003731,t2online.in,,Researchers - Batch 03 (Shifman Sagiv→Tsvelikhovsky)
20/02/2026,Ravish Kumar aur Sanjay Manjrekar ne Pakistan se Handshake ke upar kiya bawaal | IND vs PAK,https://www.youtube.com/watch?v=PANj_iI_iCs,youtube.com,,Researchers - Batch 02 (Tzarum→Zemel)
20/02/2026,"Skipper SKY, like Rohit, a father figure to his teammates: Murali Kartik - YouTube",https://www.youtube.com/watch?v=Q-S_mWNpF_Y,youtube.com,,Researchers - Batch 02 (Tzarum→Zemel)
20/02/2026,Love-In Music Festival returns to Greynolds Park for its 21st anniversary on Feb. 22,https://www.lubbockonline.com/press-release/story/135733/love-in-music-festival-returns-to-greynolds-park-for-its-21st-anniversary-on-feb-22/,lubbockonline.com,,Researchers - Batch 03 (Shifman Sagiv→Tsvelikhovsky)
20/02/2026,My Dead Summer Trailer Sets Grateful Dead Movie&#39;s Release Date | Exclusive,https://www.comingsoon.net/movies/trailers/2098465-my-dead-summer-trailer-grateful-dead-movie-release-date-exclusive,comingsoon.net,,Companies - Batch 04 (Cytovia→Lyotropic Delivery Systems)
20/02/2026,My Dead Summer (2026) Trailer - Grateful Dead Mockumentary - YouTube,https://www.youtube.com/watch?v=8ND3lymb2uI,youtube.com,,Companies - Batch 04 (Cytovia→Lyotropic Delivery Systems)
20/02/2026,Officials working to recover bodies from deadly avalanche close all forest land and trails for ... - MSN,https://www.msn.com/en-us/weather/topstories/officials-working-to-recover-bodies-from-deadly-avalanche-close-all-forest-land-and-trails-for-next-three-weeks/ar-AA1WHwUk,msn.com,,Researchers - Batch 03 (Shifman Sagiv→Tsvelikhovsky)
20/02/2026,Loblaw Companies connects with Google to give Canadians new way to shop via conversational AI,https://retailtechinnovationhub.com/home/2026/2/19/loblaw-companies-connects-with-google-to-give-canadians-new-way-to-shop-via-conversational-ai,retailtechinnovationhub.com,,Researchers - Batch 03 (Shifman Sagiv→Tsvelikhovsky)
20/02/2026,The Residents reflect on 50 years of The Third Reich &#39;n Roll - Far Out Magazine,https://faroutmagazine.co.uk/the-residents-reflect-on-50-years-of-the-third-reich-n-roll/,faroutmagazine.co.uk,,Companies - Batch 04 (Cytovia→Lyotropic Delivery Systems)
20/02/2026,Houston delegation joins thousands at Kinus Hashluchos in NYC - Jewish Herald-Voice,https://jhvonline.com/houston-delegation-joins-thousands-at-kinus-hashluchos-in-nyc-p35986-89.htm,jhvonline.com,,Researchers - Batch 09 (Ginsburg Isaac→Hochman Jacob)
20/02/2026,"James Felder Obituary (2015) - Charleston, SC",https://obits.postandcourier.com/us/obituaries/charleston/name/james-felder-obituary?id=18478107%26utm_source%3Dfacebook%26utm_medium%3Dfeed%26utm_campaign%3Dobitshare,obits.postandcourier.com,,Researchers - Batch 09 (Ginsburg Isaac→Hochman Jacob)
20/02/2026,"Former Pakistan skipper says time is up for Shaheen, Babar and Shadab after loss to India",https://www.youtube.com/watch?v=yAq2rtkbF2U,youtube.com,,Researchers - Batch 02 (Tzarum→Zemel)
20/02/2026,Marc Ribot: Hurry Red Telephone - Twin Cities Things To Do - Star Tribune,"https://www.startribune.com/things-to-do/events-calendar/show/details/Marc-Ribot-Hurry-Red-Telephone/17333361/2026-02-20T19?category=31,26,17,19,118,3,10158,10055,10171,235,208",startribune.com,,Researchers - Batch 03 (Shifman Sagiv→Tsvelikhovsky)
20/02/2026,Karthik&#39;s concert turns city into a musical carnival - The Hans India,https://www.thehansindia.com/life-style/karthiks-concert-turns-city-into-a-musical-carnival-1050263,thehansindia.com,,Researchers - Batch 02 (Tzarum→Zemel)
20/02/2026,Shadab Khan Hits Back at the Legends | Fawad Mustafa&#39;s Expert Analysis! - YouTube,https://www.youtube.com/watch?v=J1HCs9QidEA,youtube.com,,Researchers - Batch 02 (Tzarum→Zemel)
20/02/2026,Har Lamha Purjosh ki Dhoom India tak Pohanch Gai - YouTube,https://www.youtube.com/watch?v=BBXz-8DsScU,youtube.com,,Researchers - Batch 02 (Tzarum→Zemel)
20/02/2026,Joni Mitchell&#39;s Juno Lifetime Achievement Award tribute to feature Sarah McLachlan and ...,https://www.lakesmedianetwork.com/classic-hits/joni-mitchells-juno-lifetime-achievement-award-tribute-to-feature-sarah-mclachlan-and-allison-russell/,lakesmedianetwork.com,,Researchers - Batch 03 (Shifman Sagiv→Tsvelikhovsky)
20/02/2026,"After wartime slump, Israel&#39;s housing market is ready for a reset in 2026, agents say",https://www.timesofisrael.com/after-wartime-slump-israels-housing-market-is-ready-for-a-reset-in-2026-agents-say/,timesofisrael.com,,Researchers - Batch 02 (Tzarum→Zemel)
20/02/2026,"Projected lineups, previews &amp; picks for the 2026 NJSIAA Group 1 wrestling semifinals",https://www.nj.com/highschoolsports/2026/02/projected-lineups-previews-picks-for-the-2026-njsiaa-group-1-wrestling-semifinals.html,nj.com,,Companies - Batch 03 (AMAT (S) PTE.→Cooling Crops)
20/02/2026,"Grey&#39;s Anatomy star Eric Dane, who went on to be an advocate for ALS awareness, dies at 53 - CBC",https://www.cbc.ca/news/entertainment/eric-dane-greys-anatomy-als-dead-9.7098653,cbc.ca,,Researchers - Batch 03 (Shifman Sagiv→Tsvelikhovsky)
20/02/2026,Ramadan बना Pakistan का &#39;12th Man&#39;? Vice-Captain का बड़ा बयान | T20 World Cup 2026,https://www.youtube.com/watch?v=aSdWabE6e6o,youtube.com,,Researchers - Batch 02 (Tzarum→Zemel)
20/02/2026,"Bristol&#39;s new 20,000 cap arena reveals its name - Rolling Stone UK",https://www.rollingstone.co.uk/music/bristols-new-20000-cap-arena-reveals-its-name-58532/,rollingstone.co.uk,,Researchers - Batch 03 (Shifman Sagiv→Tsvelikhovsky)
20/02/2026,Women&#39;s Basketball vs LIU on 2/19/2026 - Box Score - Saint Francis University Athletics,https://sfuathletics.com/boxscore.aspx?id=13394,sfuathletics.com,,Researchers - Batch 03 (Shifman Sagiv→Tsvelikhovsky)
20/02/2026,“I come from these old <b>hippy</b> values and love and respect has got to start with you and then ...,https://www.pressreader.com/spain/mallorca-bulletin-pr/20260220/282333981372762,pressreader.com,,Companies - Batch 04 (Cytovia→Lyotropic Delivery Systems)
20/02/2026,MoFo&#39;s Markets &amp; Innovation | Morrison Foerster,https://www.mofo.com/resources/insights/260219-mofo-s-markets-innovation,mofo.com,,Researchers - Batch 03 (Shifman Sagiv→Tsvelikhovsky)
20/02/2026,Sahibzada Farhan Reveals His Favorite – Ahmad Shehzad! - Saeed Ajmal Interesting Reaction,https://www.youtube.com/watch?v=tzjU4iHjDBU,youtube.com,,Researchers - Batch 02 (Tzarum→Zemel)
20/02/2026,Super 8 Cricket Squad | Final Lineup Pakistan | Player Numbers &amp; Positions - KCHJ,https://www.youtube.com/watch?v=gOZlNCPjNLg,youtube.com,,Researchers - Batch 02 (Tzarum→Zemel)
20/02/2026,Savannah Guthrie&#39;s Absence Spurs Questions Over Next Steps at Today - Variety,https://variety.com/2026/tv/news/savannah-guthrie-absence-today-next-steps-nbc-1236667311/,variety.com,,Researchers - Batch 03 (Shifman Sagiv→Tsvelikhovsky)
20/02/2026,More than 100 film artists condemn Berlinale&#39;s censorship of opposition to Israel&#39;s Gaza genocide,https://www.wsws.org/en/articles/2026/02/20/eogy-f20.html,wsws.org,,Researchers - Batch 03 (Shifman Sagiv→Tsvelikhovsky)
20/02/2026,Who Is Megan Keller? Meet the Hockey Star Who Led Team USA to Gold | Charlotte Observer,https://www.charlotteobserver.com/sports/olympics/article314767376.html,charlotteobserver.com,,Researchers - Batch 03 (Shifman Sagiv→Tsvelikhovsky)
20/02/2026,"Stanley Glazer Obituary (2026) - Boynton Beach, FL - Legacy",https://www.legacy.com/us/obituaries/name/stanley-glazer-obituary?id=60838807,legacy.com,,Researchers - Batch 09 (Ginsburg Isaac→Hochman Jacob)
20/02/2026,FRANCHISING &amp; DISTRIBUTION—Ga. Sup. Ct.: EV car manufacturer&#39;s challenge to ... - VitalLaw.com,https://www.vitallaw.com/news/franchising-distribution-ga-sup-ct-ev-car-manufacturer-s-challenge-to-direct-sales-ban-revived/ald01f91e5ce9cc514f32a07f34df4f1a35d2,vitallaw.com,,Researchers - Batch 03 (Shifman Sagiv→Tsvelikhovsky)
20/02/2026,Crystal Palace disappoint again in Europe despite promising signs from new-look attack,https://www.the-independent.com/sport/football/crystal-palace-conference-league-ismaila-sarr-glasner-b2923941.html,the-independent.com,,Researchers - Batch 03 (Shifman Sagiv→Tsvelikhovsky)
20/02/2026,Ismaila Sarr on target as Palace draw Conference League clash in Bosnia - MSN,https://www.msn.com/en-gb/sport/other/ismaila-sarr-on-target-as-palace-draw-conference-league-clash-in-bosnia/ar-AA1WGKxx,msn.com,,Researchers - Batch 03 (Shifman Sagiv→Tsvelikhovsky)
20/02/2026,Ismaila Sarr on target as Palace draw Conference League clash in Bosnia,https://www.belfasttelegraph.co.uk/sport/football/ismaila-sarr-on-target-as-palace-draw-conference-league-clash-in-bosnia/a/134427112.html,belfasttelegraph.co.uk,,Researchers - Batch 03 (Shifman Sagiv→Tsvelikhovsky)
20/02/2026,"A popular part of Ra-Lin is closing after 7 decades, but the iconic Syracuse appliance store lives on",https://www.syracuse.com/storefront/2026/02/a-popular-part-of-ra-lin-is-closing-after-7-decades-but-the-iconic-syracuse-appliance-store-lives-on.html,syracuse.com,,Researchers - Batch 03 (Shifman Sagiv→Tsvelikhovsky)
20/02/2026,Savannah Guthrie&#39;s &#39;Today&#39; Absence Amid Mom&#39;s Disappearance Spurs Questions Over ...,https://www.imdb.com/news/ni65715624/?ref_=nwc_art_perm,imdb.com,,Researchers - Batch 03 (Shifman Sagiv→Tsvelikhovsky)
20/02/2026,Disney World ride may need repairs after unruly guests trash attraction - NY Post,https://nypost.com/2026/02/19/lifestyle/disney-world-ride-may-need-repairs-after-unruly-guests-trash-attraction/,nypost.com,,Researchers - Batch 03 (Shifman Sagiv→Tsvelikhovsky)
19/02/2026,Burger King customers can now call its president directly - NY Post,https://nypost.com/2026/02/19/lifestyle/burger-king-customers-can-now-call-its-president-directly/,nypost.com,,Researchers - Batch 03 (Shifman Sagiv→Tsvelikhovsky)
19/02/2026,Dean Henderson says Palace must learn from Conference League draw - The Irish News,https://www.irishnews.com/sport/soccer/dean-henderson-says-palace-must-learn-from-conference-league-draw-6KRIGJXXOBPLBAU2RJUVMJ2TXM/,irishnews.com,,Researchers - Batch 03 (Shifman Sagiv→Tsvelikhovsky)
19/02/2026,4 Executive Leadership Lessons From A Former Navy Tactical Officer - Forbes,https://www.forbes.com/councils/forbesbusinesscouncil/2026/02/19/why-many-ceos-would-fail-at-sea-leadership-lessons-from-a-former-navy-tactical-officer/,forbes.com,,Researchers - Batch 08 (Hochner→Klisman)
19/02/2026,Ismaila Sarr on target as Palace draw Conference League clash in Bosnia | BreakingNews,https://www.breakingnews.ie/sport/ismaila-sarr-on-target-as-palace-draw-conference-league-clash-in-bosnia-1866941.html,breakingnews.ie,,Researchers - Batch 03 (Shifman Sagiv→Tsvelikhovsky)
19/02/2026,One New Thing: Changing the Game For Financial Aid Offers,https://www.usnews.com/education/u-s-news-higher-ground/articles/2026-02-19/financial-aid-mobile-app,usnews.com,,Researchers - Batch 03 (Shifman Sagiv→Tsvelikhovsky)
19/02/2026,Hockey Team Captain Meeting with Mohsin Naqvi – Huge Development | Breaking News,https://www.youtube.com/watch?v=jRLpFjUR2Hw,youtube.com,,Researchers - Batch 02 (Tzarum→Zemel)
19/02/2026,"Billy <b>Steinberg</b>, Hitmaking Lyricist of Madonna&#39;s &#39;Like a Virgin,&#39; Dies at 75",https://www.nytimes.com/2026/02/19/arts/music/billy-steinberg-dead.html,nytimes.com,,Researchers - Batch 03 (Shifman Sagiv→Tsvelikhovsky)
19/02/2026,"Shadab Khan Aur Saim Ayub, Coach Aur Captain Kay Favorite? Shahid Hashmi&#39;s Comments",https://www.youtube.com/watch?v=gmIbsQ-7Cs0,youtube.com,,Researchers - Batch 02 (Tzarum→Zemel)
19/02/2026,Zrinjski Mostar 1-1 Crystal Palace: Eagles&#39; European dream in the balance after play-off draw,https://ca.sports.yahoo.com/news/zrinjski-mostar-1-1-crystal-195235160.html,ca.sports.yahoo.com,,Researchers - Batch 03 (Shifman Sagiv→Tsvelikhovsky)
19/02/2026,Mpumelelo Mkhabela | The Madlanga paradox: Why must truth depend on the president&#39;s whim?,https://www.news24.com/opinions/columnists/mpumelelo-mkhabela-the-madlanga-paradox-why-must-truth-depend-on-the-presidents-whim-20260218-0803,news24.com,,Researchers - Batch 03 (Shifman Sagiv→Tsvelikhovsky)
19/02/2026,Journalist Argues Team USA Should Vet Olympians About Their &#39;Patriotism&#39; | Wichita Eagle,https://www.kansas.com/sports/olympics/article314762555.html,kansas.com,,Researchers - Batch 03 (Shifman Sagiv→Tsvelikhovsky)
19/02/2026,NBC&#39;s Fast-Paced &#39;Gold Zone&#39; Conjures Visions of Quick-Hit TV Viewing Across Sports ...,https://www.imdb.com/news/ni65715935/?ref_=nwc_art_perm,imdb.com,,Researchers - Batch 03 (Shifman Sagiv→Tsvelikhovsky)
19/02/2026,NBC&#39;s Fast-Paced &#39;Gold Zone&#39; Conjures Visions Of Quick-Hit TV Viewing Across Sports ...,https://tvnewscheck.com/journalism/article/nbcs-fast-paced-gold-zone-conjures-visions-of-quick-hit-tv-viewing-across-sports-news-debates/,tvnewscheck.com,,Researchers - Batch 03 (Shifman Sagiv→Tsvelikhovsky)
19/02/2026,<b>Steinberg</b> Law Firm Attorneys Honored with Elite Lawyer 2026 Recognition,https://www.palmbeachpost.com/press-release/story/148702/steinberg-law-firm-attorneys-honored-with-elite-lawyer-2026-recognition/,palmbeachpost.com,,Researchers - Batch 03 (Shifman Sagiv→Tsvelikhovsky)
19/02/2026,West Indies Set for a Massive Comeback in T20 World Cup 2026! - Saeed Ajmal Inside Analysis,https://www.youtube.com/watch?v=oVJjKCC5qC8,youtube.com,,Researchers - Batch 02 (Tzarum→Zemel)
19/02/2026,Journalist Argues Team USA Should Vet Olympians About Their &#39;Patriotism&#39; | Modesto Bee,https://www.modbee.com/sports/olympics/article314762555.html,modbee.com,,Researchers - Batch 03 (Shifman Sagiv→Tsvelikhovsky)
19/02/2026,Journalist Argues Team USA Should Vet Olympians About Their &#39;Patriotism&#39; | The State,https://www.thestate.com/sports/olympics/article314762555.html,thestate.com,,Researchers - Batch 03 (Shifman Sagiv→Tsvelikhovsky)
19/02/2026,IKEA donates $20 plush toys to viral baby monkey Punch - NY Post,https://nypost.com/2026/02/19/lifestyle/ikea-donates-20-plush-toys-to-viral-baby-monkey-punch/,nypost.com,,Researchers - Batch 03 (Shifman Sagiv→Tsvelikhovsky)
19/02/2026,Sri Lanka Shocked After Australia! - T20 World Cup 2026 - 24 News HD - YouTube,https://www.youtube.com/watch?v=qlHVzLvuFko,youtube.com,,Researchers - Batch 02 (Tzarum→Zemel)
19/02/2026,Where Gene Hackman&#39;s dogs are now a year on from watching owners die in squalor,https://www.mirror.co.uk/3am/us-celebrity-news/gene-hackmans-dogs-now-year-36746678,mirror.co.uk,,Researchers - Batch 03 (Shifman Sagiv→Tsvelikhovsky)
19/02/2026,Loblaw partners with Google to allow customers to shop through AI Mode and Gemini,https://www.bnnbloomberg.ca/business/artificial-intelligence/2026/02/19/loblaw-partners-with-google-to-allow-customers-to-shop-through-ai-mode-and-gemini/,bnnbloomberg.ca,,Researchers - Batch 03 (Shifman Sagiv→Tsvelikhovsky)
19/02/2026,Eileen Gu Claps Back at Reporter Asking If Silver Medals Are Disappointment | Wichita Eagle,https://www.kansas.com/sports/olympics/article314760465.html,kansas.com,,Researchers - Batch 03 (Shifman Sagiv→Tsvelikhovsky)
19/02/2026,Pakistan Clarifies | Peace Board Membership Does Not Mean Military Action | BOL News,https://www.youtube.com/watch?v=7K2pgZwkS8I,youtube.com,,Researchers - Batch 02 (Tzarum→Zemel)
19/02/2026,Eileen Gu Claps Back at Reporter Asking If Silver Medals Are Disappointment | The Olympian,https://www.theolympian.com/sports/olympics/article314760465.html,theolympian.com,,Researchers - Batch 03 (Shifman Sagiv→Tsvelikhovsky)
19/02/2026,"Trump administration slashes away at science, but scientists are pushing back - Chicago Sun-Times",https://chicago.suntimes.com/columnists/2026/02/19/federal-government-funding-cuts-science-research-trump-white-house,chicago.suntimes.com,,Researchers - Batch 03 (Shifman Sagiv→Tsvelikhovsky)
19/02/2026,Super 8 Lineup Complete in T20 World Cup 2026 – All 8 Teams Confirmed | Breaking News,https://www.youtube.com/watch?v=GQQ8XdHk1jU,youtube.com,,Researchers - Batch 02 (Tzarum→Zemel)
19/02/2026,Mohsin Naqvi | Pakistan Hockey Support | World Cup Qualifier Camp - YouTube,https://www.youtube.com/watch?v=7z-r4g6pkBg,youtube.com,,Researchers - Batch 02 (Tzarum→Zemel)
19/02/2026,Foo Fighters announce new album &#39;Your Favorite Toy&#39; and share title track,https://www.rollingstone.co.uk/music/foo-fighters-announce-new-album-your-favorite-toy-and-share-title-track-58548/,rollingstone.co.uk,,Researchers - Batch 03 (Shifman Sagiv→Tsvelikhovsky)
19/02/2026,Saim Ayub Becomes No.1 T20 All-Rounder Again - YouTube,https://www.youtube.com/watch?v=FCQ7fcx7wPU,youtube.com,,Researchers - Batch 02 (Tzarum→Zemel)
19/02/2026,"IND vs NED Highlights: Suryakumar Yadav Creates History, Surpasses Rohit, Virat &amp; Dhoni",https://www.youtube.com/watch?v=ta4FRZFlNUA,youtube.com,,Researchers - Batch 02 (Tzarum→Zemel)
19/02/2026,House Republicans push to strip public benefits charge from electric bills,https://hartfordbusiness.com/article/house-republicans-push-to-strip-public-benefits-charge-from-electric-bills/,hartfordbusiness.com,,Researchers - Batch 03 (Shifman Sagiv→Tsvelikhovsky)
19/02/2026,ESPN Will Replace Summer &#39;Sunday Night Baseball&#39; With &#39;Women&#39;s Sports Sundays&#39; (EXCLUSIVE),https://malaysia.news.yahoo.com/espn-replace-summer-sunday-night-153000426.html,malaysia.news.yahoo.com,,Researchers - Batch 03 (Shifman Sagiv→Tsvelikhovsky)
19/02/2026,Walmart earnings: Sales driven by higher-income shoppers - NBC News,https://www.nbcnews.com/business/consumer/walmart-earnings-sales-higher-income-shoppers-rcna259629,nbcnews.com,,Researchers - Batch 03 (Shifman Sagiv→Tsvelikhovsky)
19/02/2026,Emerson/Park Ridge wrestling wins first sectional title in 5 years,https://www.northjersey.com/story/sports/high-school/wrestling/2026/02/18/emerson-park-ridge-nj-wrestling-first-sectional-title-5-years/88720040007/,northjersey.com,,Companies - Batch 03 (AMAT (S) PTE.→Cooling Crops)
19/02/2026,How will India Face Pakistan again in T20 World Cup 2026 Semifinal or Final? - YouTube,https://www.youtube.com/watch?v=mF2FmmPCYSo,youtube.com,,Researchers - Batch 02 (Tzarum→Zemel)
19/02/2026,Beautician found with <b>hippy</b> crack stash in her luxury BMW after being stopped by police on ...,https://www.dailymail.co.uk/news/article-15573419/Beautician-hippy-crack-stash-luxury-BMW.html,dailymail.co.uk,,Companies - Batch 04 (Cytovia→Lyotropic Delivery Systems)
19/02/2026,Annual TV award nominees announced after delay caused by death of &#39;Tehran&#39; producer,https://www.timesofisrael.com/annual-tv-award-nominees-announced-after-delay-caused-by-death-of-tehran-producer/,timesofisrael.com,,Researchers - Batch 03 (Shifman Sagiv→Tsvelikhovsky)
19/02/2026,Nepal vs Scotland T20 WC 2026: Sompal Kami&#39;s Pashupatinath-Style Meditation ...,https://www.youtube.com/watch?v=lzxRnBC653A,youtube.com,,Researchers - Batch 02 (Tzarum→Zemel)
19/02/2026,Annual TV award nominees announced after delay caused by death of &#39;Tehran&#39; producer,https://www.timesofisrael.com/annual-tv-award-nominees-announced-after-delay-caused-by-death-of-tehran-producer/amp/,timesofisrael.com,,Researchers - Batch 03 (Shifman Sagiv→Tsvelikhovsky)
19/02/2026,Shaheen Afridi Dropped? - Team management&#39;s strategy after reaching Super Eight? - Sohail Imran,https://www.youtube.com/watch?v=RFBOdDJdML0,youtube.com,,Researchers - Batch 02 (Tzarum→Zemel)
19/02/2026,OptionMetrics Announces Upgrades to Gold-Standard Historical Options Databases – IvyDB ...,https://www.businesswire.com/news/home/20260219021665/en/OptionMetrics-Announces-Upgrades-to-Gold-Standard-Historical-Options-Databases-IvyDB-US-7.0-and-IvyDB-ETF-5.0,businesswire.com,,Researchers - Batch 03 (Shifman Sagiv→Tsvelikhovsky)
19/02/2026,Sophomore Rankings: Top Girls Long Jump Marks in New Jersey This Season - NJ MileSplit,https://nj.milesplit.com/articles/420186,nj.milesplit.com,,Researchers - Batch 03 (Shifman Sagiv→Tsvelikhovsky)
19/02/2026,The master plan that will change Sprinzak-Ramat Shaul,https://haipo.co.il/en/item/613860,haipo.co.il,,Researchers - Batch 03 (Shifman Sagiv→Tsvelikhovsky)
19/02/2026,"जिम्बाब्वे का विजयरथ जारी,Sri Lanka को आखिरी ओवर में हराया | Aaj Tak Hindi News - YouTube",https://www.youtube.com/watch?v=a5mzHlpZc2Y,youtube.com,,Researchers - Batch 02 (Tzarum→Zemel)
19/02/2026,Babar Azam Didn&#39;t Bat Against Namibia | Fawad Mustafa Criticism On Captain And Mike Hesson,https://www.youtube.com/watch?v=fvrq9MJj5ks,youtube.com,,Researchers - Batch 02 (Tzarum→Zemel)
19/02/2026,Saim Ayub Big Failure | Tanvir Ahmed Major Issues And Give Instructions to Resolve | KKJ,https://www.youtube.com/watch?v=ZXMcnok9-w4,youtube.com,,Researchers - Batch 02 (Tzarum→Zemel)
19/02/2026,top 100 organizational coaches: executive coaching experts &amp; trainers - Futurist Speakers,https://www.futuristsspeakers.com/top-100-organizational-coaches-list/,futuristsspeakers.com,,Researchers - Batch 03 (Shifman Sagiv→Tsvelikhovsky)
19/02/2026,Loblaw partners with Google to allow customers to shop through AI Mode and Gemini,https://www.thealbertan.com/national-business/loblaw-partners-with-google-to-allow-customers-to-shop-through-ai-mode-and-gemini-11897319,thealbertan.com,,Researchers - Batch 03 (Shifman Sagiv→Tsvelikhovsky)
19/02/2026,A-list actor thrills fans as he shops at local newsagency in tiny Australian &#39;<b>hippy</b>&#39; town - Mail,https://www.dailymail.co.uk/tvshowbiz/article-15572557/Jacob-Elordi-mullumbimby-Wuthering-Heights.html,dailymail.co.uk,,Companies - Batch 04 (Cytovia→Lyotropic Delivery Systems)
19/02/2026,"60 Minutes, CBS Sports, Inside Edition to Leave Longtime New York Offices in Real Estate Shuffle",https://variety.com/2026/tv/news/60-minutes-cbs-sports-inside-edition-exit-new-york-offices-1236666926/,variety.com,,Researchers - Batch 03 (Shifman Sagiv→Tsvelikhovsky)
19/02/2026,Ruby Walsh Cheltenham Festival Tips: Albert Bartlett Novices&#39; Hurdle - Sporting Life,https://www.sportinglife.com/racing/news/ruby-walsh-cheltenham-festival-tips-albert-bartlett-novices-hurdle/230458,sportinglife.com,,Researchers - Batch 03 (Shifman Sagiv→Tsvelikhovsky)
19/02/2026,Was His Poor Performance Due to Bowling? Basit Ali - YouTube,https://www.youtube.com/watch?v=qvZUi7d7yoA,youtube.com,,Researchers - Batch 02 (Tzarum→Zemel)
19/02/2026,Si vous êtes aussi Venus en taureau ascendant yoga lune en <b>hippy</b> #lush - TikTok,https://www.tiktok.com/@maralafontan/video/7608158056517471510,tiktok.com,,Companies - Batch 04 (Cytovia→Lyotropic Delivery Systems)
